[
  {
    "id": "sales_data",
    "title": "Sales Data",
    "description": "Monthly sales data in CSV format for analysis and reporting",
    "defaultFilename": "sales_data.csv",
    "required": true,
    "acceptedTypes": [".csv", ".xlsx"],
    "maxSize": 5
  },
  {
    "id": "customer_data",
    "title": "Customer Information",
    "description": "Customer demographics and contact information",
    "defaultFilename": "customers.csv",
    "required": true,
    "acceptedTypes": [".csv", ".json"],
    "maxSize": 3
  },
  {
    "id": "product_catalog",
    "title": "Product Catalog",
    "description": "Product information including prices and categories",
    "defaultFilename": "products.csv",
    "required": false,
    "acceptedTypes": [".csv", ".json"],
    "maxSize": 2
  }
]